{"apiVersion":"whitetower/v1alpha1","kind":"ModuleManifest","metadata":{"displayName":"Mock enforcement point","homepage":"https://github.com/J466Y/WhiteTower","license":"Apache-2.0","name":"mock-module","vendor":"White Tower project","version":"0.1.0"},"spec":{"agents":"bound","capabilities":[{"haltLayers":["gate_closed"],"haltModes":["block"],"interventionPoints":["tool.invoke","model.invoke"],"name":"enforcement-point"},{"combiningAlgorithms":["wt-deny-overrides-v1"],"embedded":true,"languages":["cedar"],"name":"policy-engine"},{"haltLayers":["network_quarantined"],"name":"runtime-control","platforms":["kubernetes"]}],"configSchema":{"properties":{"coreUrl":{"type":"string"},"scriptedBehavior":{"description":"For tests, make acknowledgements late, missing or false.","enum":["normal","slow","silent","lying"]},"😀":{"type":"string"},"｡":{"type":"string"}},"required":["coreUrl"],"type":"object"},"contractVersions":["v1alpha1"],"events":{"consumes":[],"emits":["whitetower.decision.made.v1","whitetower.action.executed.v1","whitetower.instance.started.v1","whitetower.instance.halted.v1","whitetower.bundle.activated.v1","whitetower.bundle.rejected.v1","whitetower.lease.expired.v1","whitetower.quarantine.applied.v1","whitetower.quarantine.lifted.v1"]},"identity":"module","permissions":["governance.watch","governance.acknowledge","policy.bundles.read","events.publish"]}}