{"apiVersion":"whitetower/v1alpha1","kind":"ModuleManifest","metadata":{"description":"Loaded in the agent's process. Gates every governed call, evaluates Cedar policies from signed bundles, halts in layers, and records every decision before the action proceeds.","displayName":"White Tower enforcement point for Python","homepage":"https://github.com/J466Y/WhiteTower","license":"Apache-2.0","name":"ep-python","vendor":"White Tower project","version":"0.1.0"},"spec":{"agents":"self","capabilities":[{"frameworks":[{"name":"langgraph","versions":">=1.0,<2.0"}],"haltLayers":["gate_closed","in_flight_interrupted","process_terminated"],"haltModes":["block","interrupt","terminate"],"interventionPoints":["agent.start","input.receive","model.invoke","model.result","tool.invoke","tool.result","output.emit","agent.stop"],"name":"enforcement-point"},{"combiningAlgorithms":["wt-deny-overrides-v1"],"embedded":true,"languages":["cedar"],"name":"policy-engine"}],"configSchema":{"additionalProperties":false,"properties":{"agentId":{"type":"string"},"bufferMaxBytes":{"minimum":1048576,"type":"integer"},"bufferPath":{"description":"Location of the durable evidence buffer.","type":"string"},"bundleKeys":{"description":"File with the bundle signing keys the enforcement point trusts, its trust root.","type":"string"},"coreUrl":{"description":"Base URL of the core's machine listener.","pattern":"^https://","type":"string"},"credentials":{"additionalProperties":false,"description":"How the enforcement point authenticates as the agent.","properties":{"keyId":{"type":"string"},"privateKeyFile":{"type":"string"}},"required":["privateKeyFile","keyId"],"type":"object"},"evidence":{"additionalProperties":false,"properties":{"arguments":{"default":"names","description":"What decision events record about tool arguments (contract, section 8.3).","enum":["none","names","hashed"]}},"type":"object"},"terminateGracePeriodSeconds":{"default":10,"minimum":0,"type":"integer"}},"required":["coreUrl","agentId","credentials","bundleKeys","bufferPath"],"type":"object"},"contractVersions":["v1alpha1"],"events":{"consumes":[],"emits":["whitetower.decision.made.v1","whitetower.action.executed.v1","whitetower.instance.started.v1","whitetower.instance.halted.v1","whitetower.bundle.activated.v1","whitetower.bundle.rejected.v1","whitetower.lease.expired.v1"]},"identity":"agent","permissions":["governance.watch","governance.acknowledge","policy.bundles.read","events.publish"]}}